"S4TDRDN2","journalArticle","2019","Azunre, Gideon Abagna; Amponsah, Owusu; Peprah, Charles; Takyi, Stephen Appiah; Braimah, Imoro","A review of the role of urban agriculture in the sustainable city discourse","Cities","","0264-2751","10.1016/j.cities.2019.04.006","https://www.sciencedirect.com/science/article/pii/S0264275118303044","The debate on the role of urban agriculture in the sustainable city discourse remains unresolved in the conventional literature. Therefore, the purpose of this study was to review relevant literature to clarify the role of urban agriculture in sustainable cities. The search for literature was guided by themes such as: a) urban agricultural practices, b) indicators for the measurement of sustainable cities, c) economic, social and environmental benefits of urban agriculture, and d) negative effects of urban agriculture on the city. The results from a synthesis of the literature indicate that urban agriculture supports the economic, social and environmental sustainability of cities. However, if the discussion gives credence to only the economic dimension of sustainability, then urban agriculture loses the debate. This is because the economic benefits of prime city land that is used used for non-agricultural purposes (such as commercial or industrial) is profound. However, the social and environmental functions of responsible urban agriculture, particularly in reducing the rift between urbanisation and nature, may be difficult to quantify. These social and environmental functions underscore the importance of urban agriculture in the city landscape. The paper concludes by arguing that focussing on only economic sustainability in the urban agriculture-sustainable city discourse is a travesty of the idea of sustainable development. The paper presents practical steps that can be taken to preserve agriculture in cities towards their sustainability.","2019-10-01","2023-11-07 10:41:56","2023-11-07 10:41:56","2023-08-24 11:57:56","104-119","","","93","","Cities","","","","","","","","","","","","","ScienceDirect","","","","","","Urban agriculture; Sustainable cities; Compact cities; Global south; Urban land use planning","","","","","","","","","","","","","","","","","","","","","","","","","","","","","","","","","","","","","","","","","","","","","","",""
"ECSFH3U3","journalArticle","2021","Liebman-Pelaez, Mariana; Kongoletos, Johnathan; Norford, Leslie K.; Reinhart, Christoph","Validation of a building energy model of a hydroponic container farm and its application in urban design","Energy and Buildings","","0378-7788","10.1016/j.enbuild.2021.111192","https://www.sciencedirect.com/science/article/pii/S037877882100476X","Plant factories have developed within urban contexts following efforts to expand local food production, create local jobs, and provide alternatives to conventional agriculture with lower greenhouse gas emissions. One plant factory system, container farms, consists of artificially lit, vertically stacked hydroponic farms inside retrofitted shipping containers and support crop production in otherwise unused locations regardless of climate and daylight availability. Given their high energy intensity, municipalities considering container farms require reliable models to study their overall environmental performance and feasibility. While previous studies have used co-simulators to consider plant-air interactions within building performance simulation (BPS) tools, energy validation studies are lacking for such models. This research presents the validation of an EnergyPlus model of a hydroponic container farm in Boston, Massachusetts based on nine months of measured data. Despite shortcomings in predicting of hourly conditioning energy, the resulting calibrated energy model achieves a Normalized Mean Bias Error of 3% and a Coefficient of Variation of the Root-Mean-Square Error of 11%. Results show that through representing plant-air interactions within EnergyPlus and modeling cooling coefficient of performance as a function of outdoor air temperature, stakeholders can reliably predict annual container farm energy use.","2021-11-01","2023-11-07 10:41:56","2023-11-07 10:41:56","2023-08-24 11:57:57","111192","","","250","","Energy and Buildings","","","","","","","","","","","","","ScienceDirect","","","","","","Hydroponic; Plant factory; Urban agriculture; Energy use; Building energy model; Energy validation","","","","","","","","","","","","","","","","","","","","","","","","","","","","","","","","","","","","","","","","","","","","","","",""
"LLCY2VTU","journalArticle","2023","Al Mamun, Abdullah; Naznen, Farzana; Jingzu, Gao; Yang, Qing","Predicting the intention and adoption of hydroponic farming among Chinese urbanites","Heliyon","","2405-8440","10.1016/j.heliyon.2023.e14420","https://www.sciencedirect.com/science/article/pii/S2405844023016274","Urban agriculture has become increasingly popular as a viable solution to the global food insecurity, but the uncontrollable expansion of cities and populations has led to the significant decrease in cultivable space for conventional soil-based farming. Unlike conventional agriculture, soil-less hydroponic farming allows sustainable food production in urban areas without compromising the environment and public health. Using both theory of planned behaviour and knowledge-attitude-behaviour theory with four additional factors, the current study examined the intention and adoption of hydroponic farming among Chinese urbanites. An online survey, which involved 661 respondents from different cities in China, was conducted. The results of partial least squares structural equation modeling revealed the significant influence of tolerance of diversity, innovativeness, and knowledge about hydroponic system on attitude towards hydroponic system. Additionally, knowledge and attitude towards hydroponic system, perceived need for hydroponic farming, and hydroponic farming compatibility were found to significantly influence the intention of adopting hydroponic farming, which was also found to exhibit significant influence on its actual adoption. This study presented valuable insights that contribute to the development of a framework that promotes effective farming practices and strategies. The obtained findings can benefit marketers, practitioners, and policymakers in the agricultural and environmental fields, particularly in their efforts of planning, designing, marketing, and strategizing to promote modern agricultural practices and create a favourable environment for urban hydroponic farming in developing countries.","2023-03-01","2023-11-07 10:41:56","2023-11-07 10:41:56","2023-08-24 11:57:57","e14420","","3","9","","Heliyon","","","","","","","","","","","","","ScienceDirect","","","","","","Hydroponic farming; Urban farming; China; Knowledge-attitude-behaviour theory; Theory of planned behaviour","","","","","","","","","","","","","","","","","","","","","","","","","","","","","","","","","","","","","","","","","","","","","","",""
"5TFHGHKI","journalArticle","2023","Zeng, Siyan; Li, Juan; Wanger, Thomas Cherico","Agroecology, technology, and stakeholder awareness: Implementing the UN Food Systems Summit call for action","iScience","","2589-0042","10.1016/j.isci.2023.107510","https://www.sciencedirect.com/science/article/pii/S2589004223015870","The global food system must meet the increasing demand for food, fiber, and energy while reducing environmental impacts. The UN Food System Summit (UNFSS) has made a clear call to action for a global food systems transformation. We argue that three major discrepancies remain, potentially delaying the urgent implementation of the call to action. First, Nature-based Solutions (NbS) are not sufficiently focused on agriculture, leading to funding allocation issues. Second, a mismatch of agroecology with technology innovations may slow scaling agroecological farming. Lastly, agricultural diversification must move beyond organic landscapes and into conventional agriculture. As a solution, principles of NbS should be clear on agricultural integration. Moreover, stakeholder awareness must increase that agroecology does not necessarily conflict with agricultural technologies. Future agricultural models must apply measures such as agricultural diversification in conjunction with technology innovations to then ascertain an overall timely and successful implementation of the UNFSS call to action.","2023-09-15","2023-11-07 10:41:56","2023-11-07 10:41:56","2023-08-24 11:57:58","107510","","9","26","","iScience","Agroecology, technology, and stakeholder awareness","","","","","","","","","","","","ScienceDirect","","","","","","Ecology; Agricultural science; Agronomy; Environmental science","","","","","","","","","","","","","","","","","","","","","","","","","","","","","","","","","","","","","","","","","","","","","","",""
"PCUQFUNT","journalArticle","2021","Deepthi, Madathil Peedika; Nivethitha, Sundaram; Saminathan, Kulandaivel; Narendhirakannan, Ramasamy Thangavelu; Karmegam, Natchimuthu; Kathireswari, Palanisamy","Effect of vermiwash prepared from livestock biowaste as vermiponics medium on the growth and biochemical indices of Amaranthus viridis L.","Environmental Technology & Innovation","","2352-1864","10.1016/j.eti.2020.101300","https://www.sciencedirect.com/science/article/pii/S235218642031600X","With rising urban sprawl, the rural villages are getting transformed into urban villages and land constraints are increasing in cities, so it is difficult to designate land for farming. In this case for ensuring food security, innovative technologies like vertical indoor farming through vermiponics and aquaponics can be an alternative option for urban farming. The present study highlights the evaluation of growth and biochemical characteristics of a green vegetable, Amaranthus viridis L. in different concentrations (0, 25, 50, 75, and 100%) of cattle dung derived vermiwash (vermiponics) and aquarium water (aquaponics) with tap water as a control. The growth indices such as shoot length, root weight, shoot weight, number of primary and secondary roots, the total number of leaves, leaf area, and wet weight of A. viridis were significantly higher in 100% vermiponics (P<0.05). A maximum of 1.96 mg/g protein and 0.98 mg/g carbohydrates was recorded in 100% vermiwash treatment. Vermiwash showed significantly higher nutrients than aquarium water, which probably influenced the growth and biochemical indices of A. viridis. Conclusively, the integration of vermitechnology with hydroponics technology in vertical indoor farming can be a suitable and sustainable alternative for the futuristic urban farming methods.","2021-02-01","2023-11-07 10:41:56","2023-11-07 10:41:56","2023-08-24 11:57:58","101300","","","21","","Environmental Technology & Innovation","","","","","","","","","","","","","ScienceDirect","","","","","","Aquaponics; Cattle dung; Vermiponics; Vermiwash; Vertical indoor farming","","","","","","","","","","","","","","","","","","","","","","","","","","","","","","","","","","","","","","","","","","","","","","",""
"4UC6DRV2","journalArticle","2019","Aschemann-Witzel, Jessica; Ares, Gastón; Thøgersen, John; Monteleone, Erminio","A sense of sustainability? – How sensory consumer science can contribute to sustainable development of the food sector","Trends in Food Science & Technology","","0924-2244","10.1016/j.tifs.2019.02.021","https://www.sciencedirect.com/science/article/pii/S0924224418303923","Background Humanity's current use of resources is not in line with the goal of sustainable development. Climate change impact scenarios appear worryingly pessimistic. The agricultural and food production accounts for a particularly high share of the impact, and this also holds for consumption of food. Transforming food consumption plays a crucial role in tackling the challenges, and sensory consumer science can contribute to this. Scope and approach This commentary examines what is required of the agricultural and food sector in order to sustainably transform, and outlines the current research streams in sensory consumer science from a sustainability perspective. Based on a comparison of the requirements and research, we suggest a categorization of the contributions that sensory consumer science can make to sustainable development. Key findings and conclusions Six necessary transformations to which sensory consumer science can make a contribution are derived and outlined: 1) promotion of a dietary shift towards more sustainable foods and diets, 2) increase of food diversity, 3) food waste reduction, 4) enhancement of the circularity of the food system, 5) heightening and prioritising food-related well-being, and 6) coping with the effects of climate change. So far, sensory consumer science studies have focused on foods regarded as sustainable (e.g. organic, sustainably claimed, insects and meat alternatives) as well as issues that contribute to sustainability (e.g. shelf-life, fruit and vegetable consumption, unfamiliar food). The conclusion for further future research is that designing sensory consumer science research to explicitly target the six required transformations can increase the discipline's contribution to sustainable development.","2019-08-01","2023-11-07 10:41:56","2023-11-07 10:41:56","2023-08-24 11:57:59","180-186","","","90","","Trends in Food Science & Technology","A sense of sustainability?","","","","","","","","","","","","ScienceDirect","","","","","","Sustainability; Perception; Consumer behaviour; Research; Sensory science","","","","","","","","","","","","","","","","","","","","","","","","","","","","","","","","","","","","","","","","","","","","","","",""
"GAYR77JY","journalArticle","2023","Goh, Yee Sin; Hum, Yan Chai; Lee, Ying Loong; Lai, Khin Wee; Yap, Wun-She; Tee, Yee Kai","A meta-analysis: Food production and vegetable crop yields of hydroponics","Scientia Horticulturae","","0304-4238","10.1016/j.scienta.2023.112339","https://www.sciencedirect.com/science/article/pii/S0304423823005101","Hydroponics is a soilless farming method that can contribute to meeting the global food demand, improving food sustainability as well as ensuring food availability in a novel high efficiency yet low maintenance way. In this global meta-analysis, the crop yields of hydroponic cultivation were quantified and the differences in yields for distinct farming systems as in hydroponic vs. soil-based systems, farming orientations as in vertical vs. horizontal farming and environments as in controlled environment vs. open-air agriculture, were discussed. 499 observations were extracted from 68 papers that discussed hydroponic crop yields. The most studied vegetable crops were “Lettuce and chicory”. The greatest difference in crop productivity between hydroponics and soil-based agriculture was observed in ""Spinach,"" with yields of 2.7 kg m−2 year−1 for hydroponics compared to 16.35 kg m−2 year−1 for soil-based agriculture. The result showed that the productivity of the growing systems varied between crop categories. The impact of the growing orientation was significant for ""Lettuce & chicory"" and ""Vegetables, fresh nes"", but there was no clear pattern indicating the best growing orientation overall. The crop yields of the controlled environment were significantly higher than the open-air setup; it had a significant effect on “Anise, badian, fennel, coriander”, “Cabbage & other brassicas”, “Lettuce & chicory” and “Vegetables, fresh nes”. This meta-analysis helps in quantifying the globally relevant crop yields of hydroponic farming systems, seeks to provide more solid evidence of the crop yields for hydroponic agriculture and determines the better hydroponic growing environment.","2023-11-01","2023-11-07 10:41:56","2023-11-07 10:41:56","2023-08-24 11:57:59","112339","","","321","","Scientia Horticulturae","A meta-analysis","","","","","","","","","","","","ScienceDirect","","","","","","Controlled environment agriculture; Hydroponics; Farming systems; Meta-analysis; Open-air agriculture; Soil-based systems","","","","","","","","","","","","","","","","","","","","","","","","","","","","","","","","","","","","","","","","","","","","","","",""
"UGUHPSJD","journalArticle","2020","Stringer, L. C.; Fraser, E. D. G.; Harris, D.; Lyon, C.; Pereira, L.; Ward, C. F. M.; Simelton, E.","Adaptation and development pathways for different types of farmers","Environmental Science & Policy","","1462-9011","10.1016/j.envsci.2019.10.007","https://www.sciencedirect.com/science/article/pii/S1462901119305209","One of the greatest challenges humanity faces is feeding the world’s human population in a sustainable, nutritious, equitable and ethical way under a changing climate. Urgent transformations are needed that allow farmers to adapt and develop while also being climate resilient and contributing minimal emissions. This paper identifies several illustrative adaptation and development pathways, recognising the variety of starting points of different types of farmers and the ways their activities intersect with global trends, such as population growth, climate change, rapid urbanisation dietary changes, competing land uses and the emergence of new technologies. The feasibility of some pathways depends on factors such as farm size and land consolidation. For other pathways, particular infrastructure, technology, access to credit and market access or collective action are required. The most viable pathway for some farmers may be to exit agriculture altogether, which itself requires careful management and planning. While technology offers hope and opportunity, as a disruptor, it also risks maladaptations and can create tradeoffs and exacerbate inequalities, especially in the context of an uncertain future. For both the Sustainable Development Goals and the 2015 Paris Agreement to be achieved, a mix of levers that combine policy, technology, education and awareness-raising, dietary shifts and financial/economic mechanisms is required, attending to multiple time dimensions, to assist farmers along different pathways. Vulnerable groups such as women and the youth must not be left behind. Overall, strong good governance is needed at multiple levels, combining top-down and bottom-up processes.","2020-02-01","2023-11-07 10:41:56","2023-11-07 10:41:56","2023-08-24 11:58:00","174-189","","","104","","Environmental Science & Policy","","","","","","","","","","","","","ScienceDirect","","","","","","Climate change; Inequality; Agriculture; Sustainability; Sustainable Development Goals (SDGs); Technology; Governance; Food systems; Planetary boundaries; Transformation; Commercial farmers; Diets; Livelihoods; Paris Agreement; Smallholders","","","","","","","","","","","","","","","","","","","","","","","","","","","","","","","","","","","","","","","","","","","","","","",""
"LEXWNQPF","journalArticle","2022","Lauk, Christian; Kaufmann, Lisa; Theurl, Michaela C.; Wittmann, Fritz; Eder, Michael; Hörtenhuber, Stefan; Freyer, Bernhard; Krausmann, Fridolin","Demand side options to reduce greenhouse gas emissions and the land footprint of urban food systems: A scenario analysis for the City of Vienna","Journal of Cleaner Production","","0959-6526","10.1016/j.jclepro.2022.132064","https://www.sciencedirect.com/science/article/pii/S0959652622016717","The provision of food is fundamental for society, but it is also a major driver of environmental change. Cities are important consumers of food, harboring more than half of the global population, a share that is expected to grow in the coming decades. Here we investigate the urban food system of Vienna, a large central European city. We quantify the land and greenhouse gas (GHG) footprint of Vienna's food system and explore potentials to reduce the urban footprint through changes in food consumption, applying a counterfactual approach. We systematically compare the land and GHG effect of a shift of consumption towards i) diets with a lower share of animal products, ii) food from regional agriculture and iii) food from organic agriculture, based on the FoodClim model presented in this study. Our results show that Vienna's food system currently requires 639000 ha of agricultural land, about two thirds of it in foreign countries and emits 2.29 Mt CO2e/yr over the whole supply chain. A change in diets has the largest impact, reducing both Vienna's food system land footprint by 54% and its GHG footprint by 57%, while the effect of regionalization is comparatively small. Combined scenarios show that it is possible to maintain a healthy level of meat in diets and to switch to organic agriculture with lower land and livestock productivities and to still save half of the GHG emissions, while avoiding an expansion of the land footprint.","2022-07-20","2023-11-07 10:41:56","2023-11-07 10:41:56","2023-08-24 11:58:01","132064","","","359","","Journal of Cleaner Production","Demand side options to reduce greenhouse gas emissions and the land footprint of urban food systems","","","","","","","","","","","","ScienceDirect","","","","","","Organic agriculture; Sustainable food system; Climate change mitigation; Low meat diets; Regionalization; Urban metabolism","","","","","","","","","","","","","","","","","","","","","","","","","","","","","","","","","","","","","","","","","","","","","","",""
"RD458ENN","journalArticle","2017","Benis, Khadija; Reinhart, Christoph; Ferrão, Paulo","Development of a simulation-based decision support workflow for the implementation of Building-Integrated Agriculture (BIA) in urban contexts","Journal of Cleaner Production","","0959-6526","10.1016/j.jclepro.2017.01.130","https://www.sciencedirect.com/science/article/pii/S0959652617301452","Providing healthy food for the world’s growing urban population is a recognized global challenge and it is likely that current modes of conventional, large-scale farming will over time be increasingly complemented by local, urban farming practices. Apart from its acknowledged social benefits, urban farming is also widely viewed as a more resource-efficient alternative to conventional remote farming. Especially indoor, soilless cultivation in urban areas is being portrayed as a particularly sustainable solution. However, as this technique relies on controlled environments, its ongoing operation can be quite energy-intensive and related carbon emissions should be carefully weighed against reduced emissions, such as those from transportation. To further this goal, this article presents a simulation-based environmental analysis workflow for Building-Integrated Agriculture (BIA) in urban contexts, that includes detailed solar radiation, water and energy specific models. The aim of the workflow is to guide the user through decision-making on the potentialities of implementing BIA in a given neighborhood while maximizing crop yields and minimizing water and energy consumption. The workflow was applied to three hi-tech urban farming scenarios in Lisbon, Portugal: a polycarbonate Rooftop Greenhouse (RG), a Vertical Farm (VF) with windows and skylights on the top floor of a reinforced-concrete building as well as a completely opaque VF with no penetration of natural light on the ground floor of a reinforced-concrete building. Global Warming Potential (GWP) related to water, transportation and operational energy of these three case studies were compared to GWP of (i) the currently existing supply chain for tomato, and (ii) a hypothetical low-tech unconditioned rooftop urban farm. Results show that the RG and the top floor VF had the best overall environmental performance, respectively cutting greenhouse gas emissions in half and in three in comparison with the existing supply chain for tomato. By allowing this preliminary assessment of alternative farm locations and properties, the workflow provides the user with actionable information for early-stage holistic assessment of BIA projects.","2017-03-20","2023-11-07 10:41:56","2023-11-07 10:41:56","2023-08-24 11:58:01","589-602","","","147","","Journal of Cleaner Production","","","","","","","","","","","","","ScienceDirect","","","","","","Controlled Environment Agriculture (CEA); Building-Integrated Agriculture (BIA); Global Warming Potential (GWP); Parametric simulation; Performance-based design; Resource efficiency","","","","","","","","","","","","","","","","","","","","","","","","","","","","","","","","","","","","","","","","","","","","","","",""
