"6L8698EC","journalArticle","2017","Muller, A.; Ferré, M.; Engel, S.; Gattinger, A.; Holzkämper, A.; Huber, R.; Müller, M.; Six, J.","Can soil-less crop production be a sustainable option for soil conservation and future agriculture?","Land Use Policy","","0264-8377","10.1016/j.landusepol.2017.09.014","https://www.sciencedirect.com/science/article/pii/S026483771631376X","Agriculture faces huge challenges regarding sustainable use of soils and its sustainability performance in general. There are three different approaches to sustainable agricultural production commonly proposed, namely intensification, agro-ecological approaches and high-tech industrial approaches. Often, some propose that only agro-ecological approaches are truly sustainable options, with particular benefits for soil protection, while others argue that intensification or high-tech performs better through land sparing. In this viewpoint, we scrutinize the notion of “sustainable agricultural production” and the role these approaches may play for such, in particular addressing the controversy of “naturalness” versus “artificiality” in production systems. Consumers often perceive agriculture as “natural”, but agriculture today thrives always on strong human intervention. We posit that agriculture is linked to soils and natural processes, but that this provides little guidance on what sustainable agriculture should be. Being “natural” need not be an aspect of being sustainable. If it is, arguments for this need to be provided. Furthermore, revealed consumer preferences may much less frequently posit being “natural” as a central criterion for food consumed than usually assumed. By all this, we do not want to promote any of those three approaches uncritically. We rather argue for enlarging the option space for sustainable agriculture in an unprejudiced way.","2017-12-01","2023-11-07 10:41:54","2023-11-07 10:41:54","2023-08-24 11:57:37","102-105","","","69","","Land Use Policy","","","","","","","","","","","","","ScienceDirect","","","","","","Vertical farming; Sustainable intensification; Agro-ecology; Consumer preferences; High-tech production; Land sharing; Land sparing; Naturalistic fallacy; Naturalness; Soil-less production","","","","","","","","","","","","","","","","","","","","","","","","","","","","","","","","","","","","","","","","","","","","","","",""
"K2JHFK6M","journalArticle","2023","Boix-Fayos, Carolina; de Vente, Joris","Challenges and potential pathways towards sustainable agriculture within the European Green Deal","Agricultural Systems","","0308-521X","10.1016/j.agsy.2023.103634","https://www.sciencedirect.com/science/article/pii/S0308521X23000392","CONTEXT Agriculture plays a central role in the European Green Deal with various policies and strategies converging to promote sustainable agriculture and food systems. The Farm to Fork strategy approaches agriculture from a sustainable food systems perspective. Sustainable agriculture is also central in the European Biodiversity strategy, in the Long-term vision for EU Rural areas and in the Soil strategy. Despite clear policy objectives, there is still a long way towards an effective transition towards sustainable agriculture based on integrated, science based, solutions. OBJECTIVE This paper aims to contribute to the debate on the challenges and opportunities for the transition towards a sustainable agriculture in Europe, the role of European policies and practical approaches. METHODS We reviewed policy documents, scientific literature and global data to reflect on the vision of the Farm to Fork and other European strategies affecting sustainable agriculture, focussing on which policy instruments are foreseen to reach their objectives, which are the key-challenges related to achieve more sustainable farming, and on possible approaches to attain sustainable agriculture. RESULTS AND CONCLUSIONS We provide an overview of synergies and shared objectives between different European policies and strategies aiming to support the transition to sustainable agriculture from environmental, social and economic perspectives. We identified several often reported challenges to attain sustainable food systems: reduced yields, increased land demand, nitrogen needs, changes in diet, food waste, distribution and access to food, and externalities to third countries. Finally, we discuss two main approaches to sustainable agriculture with potential complementarity to fulfil the objectives of sustainable agriculture as reflected in the different European policies and strategies. Sustainable intensification with focus on environmental- friendly production, and agroecology with focus on ecology, social justice and food sovereignty. We reflect on how both approaches can be integrated to create synergies and optimize delivery of multiple ecosystem services. The transformation to sustainable agriculture, as expected from the several revised strategies, is not just a technical question of farming practices, but requires a holistic approach considering social, economic, cultural, technical and environmental aspects. Local adaptations, stakeholder participation, and recognition that agriculture produces more than crops, are key to support this transition of agriculture and food systems. SIGNIFICANCE The transition towards more sustainable agriculture requires alignment of policies related to social, economic and environmental aspects, including social and economic acknowledgment to farmers, as managers of agroecosystems and cultural landscapes delivering a range of ecosystem services.","2023-04-01","2023-11-07 10:41:55","2023-11-07 10:41:55","2023-08-24 11:57:37","103634","","","207","","Agricultural Systems","","","","","","","","","","","","","ScienceDirect","","","","","","Sustainable intensification; Agroecology; Biodiversity strategy; Farm to fork strategy; Green deal; Long term vision for EU rural areas; Soil strategy; Sustainable farming","","","","","","","","","","","","","","","","","","","","","","","","","","","","","","","","","","","","","","","","","","","","","","",""
"HS6VQYHQ","journalArticle","2023","Martin, Michael; Bengtsson, Elin; Carotti, Laura; Orrestig, Kristin; Orsini, Francesco","Environmental assessment of greenhouse herb production: A case of longitudinal improvement options in Sweden","Resources, Conservation and Recycling","","0921-3449","10.1016/j.resconrec.2023.106948","https://www.sciencedirect.com/science/article/pii/S092134492300085X","The greenhouse sector has seen many advances to improve its resource demands, though little is known of the environmental impacts. This study aims to assess the environmental performance of a horticultural greenhouse in Sweden producing herbs. Life cycle assessment is employed to analyze different scenarios. These include previous measures, such as switching to organic fertilizers, a pellet burner, and reducing the packaging weight. Future scenarios are assessed, including increasing biofueled logistics, switching to LEDs, densifying production, and including recyclable packaging. The results suggest that GHG emissions were reduced by 32% per kg edible portion through past scenarios in current scenario. Additionally, densifying production and switching to LED lighting can lead to an additional 14% and 10% reduction in GHG emissions compared to the current system respectively, while also reducing other environmental impact categories. These results provide insights into the implications of environmental and resource improvement measures taken at greenhouses.","2023-06-01","2023-11-07 10:41:55","2023-11-07 10:41:55","2023-08-24 11:57:38","106948","","","193","","Resources, Conservation and Recycling","Environmental assessment of greenhouse herb production","","","","","","","","","","","","ScienceDirect","","","","","","Sustainability; Controlled environment agriculture; hydroponic; Greenhouse horticulture; LED lighting; life cycle assessment (LCA)","","","","","","","","","","","","","","","","","","","","","","","","","","","","","","","","","","","","","","","","","","","","","","",""
"BH2F3N5Y","journalArticle","2023","Coronado-Apodaca, Karina G.; Martínez-Ruiz, Manuel; Iqbal, Hafiz M. N.; Sosa-Hernandez, Juan Eduardo; Parra-Saldívar, Roberto","Agro-food sustainability transitions: New Frontiers for food security","Current Opinion in Environmental Science & Health","","2468-5844","10.1016/j.coesh.2022.100412","https://www.sciencedirect.com/science/article/pii/S2468584422000873","Population growth over time has provoked an urgency to ensure food security. The issue of food sustainability transitions has sparked the interest of researchers due to food security being one of the greatest challenges of the new century. It is important to document that ensuring food security does not mean only a boost in food production, if not, it is something even more complex. The challenge includes the adaptation of eating habits and the implementation of new technologies and strategies that allow the food production system to be sustainable and environmentally friendly. A route with the purpose of securing natural resources while climate change is halted. This article shows a brief description of the actual situation of food security transitions considering transition strategies and the limitation caused by natural resources focused on water requirements.","2023-02-01","2023-11-07 10:41:55","2023-11-07 10:41:55","2023-08-24 11:57:38","100412","","","31","","Current Opinion in Environmental Science & Health","Agro-food sustainability transitions","","","","","","","","","","","","ScienceDirect","","","","","","Sustainability; Food security; Transformation of the food system; Transitions pathways","","","","","","","","","","","","","","","","","","","","","","","","","","","","","","","","","","","","","","","","","","","","","","",""
"VCL8UB3I","journalArticle","2023","Jaeger, Sara R.; Harker, F. Roger; Ares, Gastón","Consumer insights about sustainable and ‘beyond organic’ agriculture: A study of biodynamics in the United Kingdom, Australia, Singapore, and Germany","Journal of Cleaner Production","","0959-6526","10.1016/j.jclepro.2023.136744","https://www.sciencedirect.com/science/article/pii/S0959652623009022","Agricultural systems that classify as ‘beyond organic’ have the potential to advance sustainability efforts. The present research considers these emerging systems from a consumer insights perspective. Using biodynamic (BD) agriculture as an exemplar, public opinions were explored in a multi-method and multi-national study with samples of consumers in the United Kingdom (UK), Australia, Singapore, and Germany. Across 1237 participants, the empirical findings pointed to largely positive attitudes. Between-country differences were minor, whereas consumer segmentation identified pan-national groups of people with attitudes that were, respectively, BD Positive (71%), BD Neutral (20%) or BD Negative (9%). In the BD Positive segment, consumers responded positively to the environmental and social aspects of BD agriculture, and it mattered to them that BD agriculture was a balanced and integrated approach to farming/food production. That is, they were not averse to the holistic/spiritual aspects that are unique to BD. Biodiversity, but also other aspects of environmental sustainability mattered more to consumers than social sustainability, notably worker welfare and community resilience. The research provides new consumer insights about biodynamics by being generic to BD agriculture rather than product specific (e.g., BD wine), and advances extant consumer research by jointly exploring environmental and social sustainability. Several practical implications emerge from the results.","2023-05-15","2023-11-07 10:41:55","2023-11-07 10:41:55","2023-08-24 11:57:39","136744","","","401","","Journal of Cleaner Production","Consumer insights about sustainable and ‘beyond organic’ agriculture","","","","","","","","","","","","ScienceDirect","","","","","","","","","","","","","","","","","","","","","","","","","","","","","","","","","","","","","","","","","","","","","","","","","","","","",""
"H7SBWF5Q","journalArticle","2023","Yadav, Shubh Pravat Singh; Lahutiya, Vivek; Ghimire, Netra Prasad; Yadav, Bishnu; Paudel, Prava","Exploring innovation for sustainable agriculture: A systematic case study of permaculture in Nepal","Heliyon","","2405-8440","10.1016/j.heliyon.2023.e15899","https://www.sciencedirect.com/science/article/pii/S2405844023031067","As the adverse consequences of the industrial/modern agricultural framework, which encompasses high-input agrarian production and intensive cultivation, are increasing, an alternative is essential. Permaculture is a bunch of sustainable practices that incorporate an assortment of components and promote comprehensive and multi-polycultures including perennial plants, high degrees of biodiversity, crop-animal integration, whole watershed management, and self-sustaining on-site energy production, all of which straightforwardly affect the sustainable approach and promote ecological parameters. This case study attempts to better comprehend the local knowledge in terms of planning and fostering a permaculture system that considers their work, culture, and environmental concerns. In particular, this research focuses on the combined ideology, actual practices, and co-opting nature of three Nepalese permaculturists. The current study employs the notion of imaginaries to comprehend how permaculture may supplant the present agricultural system. Therefore, the study promotes and urges agricultural actioners to create profound and emotional associations with the planet, as well as their creativity and imagination, to impact good natural change.","2023-05-01","2023-11-07 10:41:55","2023-11-07 10:41:55","2023-08-24 11:57:39","e15899","","5","9","","Heliyon","Exploring innovation for sustainable agriculture","","","","","","","","","","","","ScienceDirect","","","","","","Agriculture; Ecological impacts; Ethics; Modern/industrial agricultural system; Nepal; Permaculture; Principles; Sustainable","","","","","","","","","","","","","","","","","","","","","","","","","","","","","","","","","","","","","","","","","","","","","","",""
"DWFF3359","journalArticle","2021","Riccaboni, Angelo; Neri, Elena; Trovarelli, Francesca; Pulselli, Riccardo Maria","Sustainability-oriented research and innovation in ‘farm to fork’ value chains","Current Opinion in Food Science","","2214-7993","10.1016/j.cofs.2021.04.006","https://www.sciencedirect.com/science/article/pii/S2214799321000722","The European Green Deal clearly declares the ambitious goal of making European food ‘the global standard for sustainability’ on the basis of an integrated approach encompassing all aspects of food supply chains. The Farm to Fork Strategy asserts that research and innovation are key drivers in accelerating the transition to sustainable, healthy and inclusive food systems, from primary production to consumption. Therefore, in this paper, the most promising fields of innovation towards this transition in the agrifood sector have been reviewed with reference to the value chain actors engaged in their implementation. Although not exhaustive, this short survey presents a selection of solutions that have in recent years been viewed as ‘first mover’ opportunities for innovation in the agrifood sector where changes have been initiated but need to be further implemented. The paper first discusses options that allow agrifood businesses to operate directly as innovation providers, and then expands on the role of public stakeholders, namely consumers, policy makers and researchers, to act as agents of change and contribute to pave the way to a ‘green deal’ in Europe. The survey concludes by highlighting the possibility of developing integrated approaches to research and innovation to ensure the sustainability of the food system through cooperative actions engaging both private and public actors in the value chain.","2021-12-01","2023-11-07 10:41:55","2023-11-07 10:41:55","2023-08-24 11:57:40","102-112","","","42","","Current Opinion in Food Science","","","","","","","","","","","","","ScienceDirect","","","","","","","","","","","","","","","","","","","","","","","","","","","","","","","","","","","","","","","","","","","","","","","","","","","","",""
"AGT6JU58","bookSection","2023","Karaca, Mehmet; Ince, Ayse Gul","Chapter 8 - Revisiting sustainable systems and methods in agriculture","Sustainable Agriculture and the Environment","978-0-323-90500-8","","","https://www.sciencedirect.com/science/article/pii/B978032390500800004X","Global climate change and population growth are two key issues that are currently the subject of discussions around the world. Currently, there are around 7.5 billion people on the planet Earth, and it is estimated that the population will grow by over 12 billion, the majority of whom will be living in mega cities in 2100. This means we need to produce more agricultural food while the global temperature increases. Molecular agriculture, hydroponics, or aquaponics indoor production through sky farming and nursery businesses are among the current topics on feeding, the planet Earth. In this chapter, we revisit some sustainable systems and methods used in agriculture. Different strategies of sustainable agricultural systems and methods seek to develop a sustainable environment and food production to increase crop productivity and soil health. This reduce the impacts of global climate change, through the adaptation and building of crop resilience, as well as conserving biodiversity, capturing carbon in the soil, and reducing the emission of greenhouse gases. Sustainability can be defined as the avoidance of the depletion of natural resources to maintain an ecological balance at a certain rate and it finds its exact definition in the biological systems where there exists exchange, but no waste is produced. Sustainable agriculture can be defined as desired type of agricultural activity to supply society's food and textile needs in the present without compromising the ability of future generations to meet their own needs. From this definition, it is clear to note that an agricultural system cannot be sustainable if it causes environmental damage. Therefore, the environmental sustainability of agriculture is related to the preservation, restoration, and improvement of all natural elements such as air, water, soil, and their proper recycling along with the biodiversity of plant, animal, and microorganisms. Environmental sustainability and sustainable agriculture include the intentional practice of maintaining (engineering or mimicking the nature) healthy soil; managing water wisely; reducing food waste; minimizing pollution of air, water, and soil; promoting biodiversity; reducing tillage; integrating pest management; integrating livestock and crops; adopting sustainable practices, while enhancing the quality of life for communities of agriculture. To date, several sustainable agricultural systems and methods have been developed. In this chapter we revisit several dominant sustainable agriculture systems and methods practiced in agriculture. Each system has advantages and disadvantages. Therefore, we need to use more than one system in sustainable agriculture. The key to sustainable agriculture is finding the right balance between the need for food production and the preservation of environmental ecosystems. However, today's majority of conventional agriculture and biotechnology are in directions as in the 20th century and before which focused on only more productions. Production-oriented agriculture already caused significant global climate change, water scarcity, land degradation, deforestation, and loss of biodiversity including agrobiodiversity. Grafting was added to the list of methods that could be used in all systems as a method of sustainable agriculture. We also provided definitions for individual systems and briefly explained the most common methods.","2023-01-01","2023-11-07 10:41:55","2023-11-07 10:41:55","2023-08-24 11:57:41","195-246","","","","","","","","","","","Academic Press","","","","","","","ScienceDirect","","","","","","Climate change; Permaculture; Agroforestry; Biodiversity; Contamination; Grafting; Organic agriculture; Overpopulation; Pollution; Regenerative agriculture","","Farooq, Muhammad; Gogoi, Nirmali; Pisante, Michele","","","","","","","","","","","","","","","","","","","","","","","","","","","","","","","","","","","","","","","","","","","","",""
"ALZI7UD7","journalArticle","2019","Gentry, Matthew","Local heat, local food: Integrating vertical hydroponic farming with district heating in Sweden","Energy","","0360-5442","10.1016/j.energy.2019.02.119","https://www.sciencedirect.com/science/article/pii/S0360544219303184","By 2050, it is estimated that 70% of the world's population will live in urban areas. This growth in cities creates a demand for fresh produce to ensure a healthy population, produce that often has to travel a long way to reach the consumer, not only losing quality and nutrition along the way, but also requiring a significant fossil fuel cost for transportation and storage. The average plate of food will travel over 2400 km before it reaches your plate. There is potential within District heating (DH) areas to move farming indoors and into the heart of the urban environment. Vertical hydroponic farming (VHF) offers many advantages over conventional farming including more efficient water and land use, and vastly reduced transport costs if it is performed in the urban area. For this model to become economically sustainable however, it must be intelligently integrated into existing urban infrastructure. A mutually beneficial relationship with DH is possible whereby VHFs are integrated to feed back into the DH system, lower the return temperature in line with 4th Generation District Heating guidelines, and reduce CO2 emissions in food and energy production.","2019-05-01","2023-11-07 10:41:55","2023-11-07 10:41:55","2023-08-24 11:57:42","191-197","","","174","","Energy","Local heat, local food","","","","","","","","","","","","ScienceDirect","","","","","","Vertical farming; Plant factories; 4th Generation District Heating; CO2 reduction; Hydroponic farming; Smart energy","","","","","","","","","","","","","","","","","","","","","","","","","","","","","","","","","","","","","","","","","","","","","","",""
"Q8NPMZ97","journalArticle","2021","Sipos, László; Balázs, László; Székely, Géza; Jung, András; Sárosi, Szilvia; Radácsi, Péter; Csambalik, László","Optimization of basil (Ocimum basilicum L.) production in LED light environments – a review","Scientia Horticulturae","","0304-4238","10.1016/j.scienta.2021.110486","https://www.sciencedirect.com/science/article/pii/S0304423821005938","Basil (Ocimum basilicum L.) is a popular crop worldwide among farmers; it is relatively easy to grow and is well adapted to hydroponic and Controlled Environment Agriculture (CEA) systems having a high profitability margin. Several studies investigated the effect of the environmental factors on the qualitative and quantitative factors of basil: the effect of light is crucial for development, nutritional properties and sensory characteristics. The principles of sustainability, profitability and resource-effectiveness all encourages farmers to use energy-efficient LED light sources. These tools easily allow for the modification of spectral distribution and light intensity; numerous suggestions have been made for developing goal-driven light recipes for maximum cost-effectiveness and for reducing carbon footprint. Here, the results of several studies are summarized for providing a solid base for light recipe utilization of basil production in terms of light intensity, duration, and spectral distribution. Experimental results related to the impact of light treatments on vegetative parameters, phytonutrient content and sensory properties of basil are discussed, and optimal ranges of light parameters are summarized. Due to the increasing number of promising specialized research the wider application of purpose-driven high-tech production systems is expected in future basil growing.","2021-11-17","2023-11-07 10:41:55","2023-11-07 10:41:55","2023-08-24 11:57:42","110486","","","289","","Scientia Horticulturae","","","","","","","","","","","","","ScienceDirect","","","","","","Plant factory; Light effect; Light emitting diode; Light recipe; Smart system","","","","","","","","","","","","","","","","","","","","","","","","","","","","","","","","","","","","","","","","","","","","","","",""
